{"comparison_id":"hnsw-merger-sift1m-structural","formal_graph_parity":false,"generated_at":"2026-08-17T16:50:43.498558Z","m0":{"build_manifest_path":"manifests/hnsw-merger-sift1m-structural-m0/stages/merge.json","evaluation_report_path":"reports/hnsw-merger-sift1m-structural-m0-evaluation.json","global_graph":{"aggregate_checksum":"ae4d266202ee3fe49008b8012db050270ac9ddb1c3e9f7b5fe749748f0dcd4ef","artifact_type":"global_graph","format_version":"global-graph-artifact/v1","metadata_path":"hnsw-merger-sift1m-structural-m0/merge/artifact.json"},"implementation_id":"cpp_main_78256bbab4685e1774e78d331e081a153be26823_m0_callable_v1","implementation_version":"1.0.0","run_id":"hnsw-merger-sift1m-structural-m0","status":"SUCCEEDED","structural_findings":{"degree_bound_pass":true,"invalid_neighbor_count":0,"lineage_pass":true,"node_count":1000000,"observed_max_degree":16,"self_edge_count":0},"validation_evidence_path":"manifests/evidence/hnsw-merger-sift1m-structural-m0-merge-valid.json"},"m1":{"build_manifest_path":"manifests/hnsw-merger-sift1m-structural-m1/stages/merge.json","evaluation_report_path":"reports/hnsw-merger-sift1m-structural-m1-evaluation.json","global_graph":{"aggregate_checksum":"3c161de688956aaef691dff21a53038b4f17e7c857a9b7e4516cb837e14031a7","artifact_type":"global_graph","format_version":"global-graph-artifact/v1","metadata_path":"hnsw-merger-sift1m-structural-m1/merge/artifact.json"},"implementation_id":"hnsw_merger_vamana_merge_v1","implementation_version":"1.0.0","run_id":"hnsw-merger-sift1m-structural-m1","status":"SUCCEEDED","structural_findings":{"degree_bound_pass":true,"invalid_neighbor_count":0,"lineage_pass":true,"node_count":1000000,"observed_max_degree":16,"self_edge_count":0},"validation_evidence_path":"manifests/evidence/hnsw-merger-sift1m-structural-m1-merge-valid.json"},"query_evaluation_performed":false,"replacement_scope":"merge","reproduction_mode":"faithful_adaptation","schema_version":"same-input-structural-comparison/v1","shared_input_identity":"PASS","shared_inputs":{"dataset":{"aggregate_checksum":"4935b25f2cb2af2a05c7a657c3beb9c1823f45d1cf067f1d298169bb721f377e","artifact_type":"dataset","format_version":"diskann-float32-dataset/v1","metadata_path":"datasets/sift1m/artifact.json"},"local_graphs":[{"artifact":{"aggregate_checksum":"db2f34439a030dcdcd946412217986c5c59d8e3ae92100b0c66c47f9eec640e1","artifact_type":"local_graph","format_version":"local-graph-artifact/v1","metadata_path":"cpp-main-sift1m-20260807T023200Z/local-0/artifact.json"},"partition_id":0},{"artifact":{"aggregate_checksum":"fec50a8a95d3340115315a3bb89f6de66db7d907af362b0d8b4c33cd155011ec","artifact_type":"local_graph","format_version":"local-graph-artifact/v1","metadata_path":"cpp-main-sift1m-20260807T023200Z/local-1/artifact.json"},"partition_id":1},{"artifact":{"aggregate_checksum":"69dd394a5218da4d2f44e3eaf54ac50bd1c558bffe3b145692d5e3ef049197fb","artifact_type":"local_graph","format_version":"local-graph-artifact/v1","metadata_path":"cpp-main-sift1m-20260807T023200Z/local-2/artifact.json"},"partition_id":2}],"m0_validation_evidence":["manifests/evidence/hnsw-merger-sift1m-structural-m0-merge-only-dataset-valid.json","manifests/evidence/hnsw-merger-sift1m-structural-m0-merge-only-partition-valid.json","manifests/evidence/hnsw-merger-sift1m-structural-m0-merge-only-local-0-valid.json","manifests/evidence/hnsw-merger-sift1m-structural-m0-merge-only-local-1-valid.json","manifests/evidence/hnsw-merger-sift1m-structural-m0-merge-only-local-2-valid.json","manifests/evidence/hnsw-merger-sift1m-structural-m0-merge-valid.json"],"m1_validation_evidence":["manifests/evidence/hnsw-merger-sift1m-structural-m1-merge-only-dataset-valid.json","manifests/evidence/hnsw-merger-sift1m-structural-m1-merge-only-partition-valid.json","manifests/evidence/hnsw-merger-sift1m-structural-m1-merge-only-local-0-valid.json","manifests/evidence/hnsw-merger-sift1m-structural-m1-merge-only-local-1-valid.json","manifests/evidence/hnsw-merger-sift1m-structural-m1-merge-only-local-2-valid.json","manifests/evidence/hnsw-merger-sift1m-structural-m1-merge-valid.json"],"partition":{"aggregate_checksum":"afc492868685683e102a3908d5524d01eb01c5793a93134550d05c9f1992e0c1","artifact_type":"partition","format_version":"partition-artifact/v1","metadata_path":"cpp-main-sift1m-20260807T023200Z/partition/artifact.json"}},"structural_validation":"PASS","study_class":"single_paper_reproduction"}